Whether you’re looking for [Noun Attribute], [Noun Attribute] or [Noun Attribute], you’ve come to the right place.  [Manufacturer]’s [Product Category Keyword] [product]s are hands down the [Best Synonym] [product]s [On the Market Synonym].  [Farewell Phrase] [Negative Attribute] [product]s that [Negative Adjective] and make life [Miserable Synonym].  [Manufacturer]’s [Product Descriptor] [product]s are [Past Participle Phrase] and make your kitchen activities [Positive Adjective].  Take advantage of this opportunity while supplies last!     Let us show you why we’re the industry’s [KR Descriptor] restaurant equipment and restaurant supplies [Seller Synonym].  Shop now to get access to our [Synonym for Large] inventory, [Customer Service Attribute] customer support and 30-day price match guarantee.  You will thank yourself for buying from Kitchen Restock - we guarantee it!  ;
Congratulations, you’ve stumbled upon the [KR Descriptor] collection of [Product Category Keyword] [product]s on the internet! Made with [Noun Attribute], [Noun Attribute] and [Noun Attribute], [Manufacturer]’s [product]s are [Past Participle Phrase].  [Farewell Phrase] to your struggles with [Negative Attribute] [product]s that [Miserable Synonym] - you’ve suffered long enough.  [Manufacturer]’s [Product Descriptor] [product]s, gets the job done the first time around, so you can count on it to fulfill your needs.  Finally, a solution that turns your kitchen into [Kitchen Phrase] for everyone involved!  Don’t forget, when you buy from us, you’re buying from the industry’s [KR Descriptor] restaurant equipment and restaurant supplies [Seller Synonym].  You can count on us to offer these qualities: [Synonym for Large] inventories, [Customer Service Attribute] customer support and low APR financing.;
Have you been looking for [product]s that are [Past Participle Phrase]? No need to look any further, everything you need is right here! [Manufacturer’s] [Product Descriptor] [product]s are the [Product Category Keyword] [product]s you need to make your kitchen [Kitchen Phrase] to work in.  These [product]s are built with [Noun Attribute] and [Noun Attribute], making them the perfect addition to your kitchen.  [Farewell Phrase] to those dreaded [Negative Attribute] [product]s that [Negative Adjective], and say hello to [product]s you can rely on to get the job done day in and day out.  Shop now to access our 30-day price match guarantee, [Synonym for Large] inventories and [Customer Service Attribute] customer service, and we’ll show you why we’re the market’s [KR Descriptor] restaurant equipment and supplies [Seller Synonym]. ;
If you’ve [Looking Everywhere Synonym] for [product]s, your journey ends here.  [Farewell Phrase] to [Negative Attribute] [product]s that make your life [Miserable Synonym] - don’t let them [Negative Adjective] anymore.  [Manufacturer]’s [Product Descriptor] [product]s are made with [Noun Attribute] and are [Past Participle Phrase], qualities that make them the [Best Synonym] [Product Category Keyword] [product]s [On the Market synonym].  Want to make kitchen prep [Positive Adjective]? Grab [Manufacturer]’s [product]s now! Trust us, you’re making the right decision.  Hot tip: buying from us means buying from the industry’s [KR Descriptor] restaurant equipment and restaurant supplies [Seller Synonym].  We pride ourselves on the following: [Synonym for Large] inventories, [Customer Service Attribute] customer support and our [FASTSHIPPING Descriptor] FASTSHIPPING™ program.  Shop now to take advantage of these perks!;
Maybe you’ve [Looking Everywhere Synonym] for [Product Category Keyword] [product]s, or maybe you just started searching.  Either way, [Manufacturer]’s [Product Descriptor] [product]s are exactly what you need! Formed with [Noun Attribute] and [Noun Attribute], these [Product Category Keyword] [product]s are [Past Participle Phrase], [Enabling Synonym] you to transform your kitchen into a [Kitchen Phrase] to work from.  So what are you waiting for? Leave your [Negative Attribute] [product]s that [Negative Adjective] behind and [Enhance Synonym] your productivity with [Manufacturer]’s [product]s today!  Note: when you buy from us, you’re buying from the industry’s [KR Descriptor] restaurant equipment and supplies [Seller Synonym].  Start shopping now to get access to our [FASTSHIPPING Descriptor] FASTSHIPPING™ program, [Synonym for Large] inventories guarantee and [Customer Service Attribute] customer support.;
[Manufacturer]’s [product]s are the [Best Synonym] [Product Category Keyword] [product]s [On the Market Synonym].  They’re [Product Descriptor], [Product Descriptor] and [Product Descriptor], but most importantly, they’re [Past Participle Phrase].  That means you no longer have to struggle with [Negative Attribute] [product]s that make life [Miserable Synonym] and [Negative Adjective]  Whether you’re looking for [FASTSHIPPING Descriptor] quality or simply a cost-effective solution, you’ve come to the right place.  [Manufacturer]’s [Product Descriptor] [product]s are the [Best Synonym] [product]s available, and we guarantee it’s the right fit for your needs.  Shopping with us comes with a long list of perks, including getting access to the lowest prices on the internet.  We also take pride in our [Synonym for Large] inventory, [Customer Service Attribute] customer service and 30-day price match guarantee.  If you need restaurant equipment of any kind, buying from Kitchen Restock is a no-brainer!  ;
